{"_meta": {"api_version": "1", "contract_version": "1.14", "generated_at": "2026-07-13T05:11:21+00:00", "provenance": "socrata", "data_tier": "mixed", "tier_note": "roster + contact info are real (city Ward Offices dataset); safety_record aggregates are derived (council sponsorship counts); menu_spending is a proxy.", "license": "City of Chicago Data Portal Terms of Use (data.cityofchicago.org); derived analyses by On Your Left!", "attribution": "On Your Left! \u2014 Chicago bike safety, on the record (https://github.com/jartinator/chicago-safe-streets-data)", "human_page": "https://jartinator.github.io/chicago-safe-streets-data/action.html", "methodology": "https://jartinator.github.io/chicago-safe-streets-data/methodology.html", "schema": "https://jartinator.github.io/chicago-safe-streets-data/api/v1/schemas/council-aldermen.schema.json"}, "as_of": "2026-07-13T05:07:16+00:00", "roster_note": "Current alderperson roster from the city's Ward Offices dataset; refreshed each pipeline run. Vacant seats appear as null.", "menu_note": "Ward Wise (wardwisechicago.org), the only structured source for aldermanic menu spending, was unreachable this run (the city itself only publishes PDF reports). See CONTRIBUTING.md.", "safety_record_note": "Aggregate of Chicago City Council sponsorships on matters tagged topic_relevant (see council_records.json), plus recorded_no_votes: the count of the rare recorded roll-call votes where this member voted 'no' on a topic-relevant matter. Most council street-safety actions pass by voice vote with no individual vote recorded, so recorded_no_votes is near-zero for nearly everyone by design, not omission. ward is null until sponsor_name exactly matches the manually-filled aldermen.json (DECISIONS.md #8) \u2014 never auto-matched by fuzzy name similarity.", "aldermen": [{"ward": "1", "alderman": "La Spata, Daniel", "email": "Ward01@cityofchicago.org", "phone": "(872) 206-2685", "website": "https://www.the1stward.com/", "safety_record": {"safety_sponsorships": 5, "total_matched_sponsorships": 5, "recorded_no_votes": 0}, "menu_spending": {"available": false}, "detail_url": "https://jartinator.github.io/chicago-safe-streets-data/api/v1/wards/ward-01.json"}, {"ward": "2", "alderman": "Hopkins, Brian", "email": "office@aldermanhopkins.com", "phone": "(312) 744-6836 / 9867/6213", "website": "https://www.aldermanhopkins.com/", "safety_record": {"safety_sponsorships": 2, "total_matched_sponsorships": 2, "recorded_no_votes": 0}, "menu_spending": {"available": false}, "detail_url": "https://jartinator.github.io/chicago-safe-streets-data/api/v1/wards/ward-02.json"}, {"ward": "3", "alderman": "Dowell, Pat", "email": "Ward03@cityofchicago.org", "phone": "(773) 373-9273", "website": "http://www.ward03chicago.com", "safety_record": {"safety_sponsorships": 6, "total_matched_sponsorships": 6, "recorded_no_votes": 0}, "menu_spending": {"available": false}, "detail_url": "https://jartinator.github.io/chicago-safe-streets-data/api/v1/wards/ward-03.json"}, {"ward": "4", "alderman": "Robinson, Lamont J.", "email": "Ward04@cityofchicago.org", "phone": "(312)744-2690", "website": null, "safety_record": null, "menu_spending": {"available": false}, "detail_url": "https://jartinator.github.io/chicago-safe-streets-data/api/v1/wards/ward-04.json"}, {"ward": "5", "alderman": "Yancy, Desmon C.", "email": "Ward05@cityofchicago.org", "phone": "(312) 744-6832", "website": null, "safety_record": null, "menu_spending": {"available": false}, "detail_url": "https://jartinator.github.io/chicago-safe-streets-data/api/v1/wards/ward-05.json"}, {"ward": "6", "alderman": "Hall, William E.", "email": "Ward06@cityofchicago.org", "phone": "(773) 241-3100", "website": null, "safety_record": null, "menu_spending": {"available": false}, "detail_url": "https://jartinator.github.io/chicago-safe-streets-data/api/v1/wards/ward-06.json"}, {"ward": "7", "alderman": "Mitchell, Gregory I.", "email": "Ward07@cityofchicago.org", "phone": "(773) 731-7777", "website": "http://www.gregmitchell7thward.org/", "safety_record": null, "menu_spending": {"available": false}, "detail_url": "https://jartinator.github.io/chicago-safe-streets-data/api/v1/wards/ward-07.json"}, {"ward": "8", "alderman": "Harris, Michelle A.", "email": "Ward08@cityofchicago.org", "phone": "(773) 874-3300", "website": "http://www.Aldermanmichelleharris.net", "safety_record": {"safety_sponsorships": 2, "total_matched_sponsorships": 2, "recorded_no_votes": 0}, "menu_spending": {"available": false}, "detail_url": "https://jartinator.github.io/chicago-safe-streets-data/api/v1/wards/ward-08.json"}, {"ward": "9", "alderman": "Beale, Anthony", "email": "Ward09@cityofchicago.org", "phone": "(773) 785-1100", "website": "http://www.Ward09.com", "safety_record": {"safety_sponsorships": 2, "total_matched_sponsorships": 2, "recorded_no_votes": 0}, "menu_spending": {"available": false}, "detail_url": "https://jartinator.github.io/chicago-safe-streets-data/api/v1/wards/ward-09.json"}, {"ward": "10", "alderman": "Chico, Peter", "email": "Ward10@cityofchicago.org", "phone": "(773) 768-8138", "website": null, "safety_record": null, "menu_spending": {"available": false}, "detail_url": "https://jartinator.github.io/chicago-safe-streets-data/api/v1/wards/ward-10.json"}, {"ward": "11", "alderman": "Lee, Nicole T.", "email": "Ward11@cityofchicago.org", "phone": "(773) 254-6677", "website": null, "safety_record": null, "menu_spending": {"available": false}, "detail_url": "https://jartinator.github.io/chicago-safe-streets-data/api/v1/wards/ward-11.json"}, {"ward": "12", "alderman": "Ramirez, Julia M.", "email": "Ward12@cityofchicago.org", "phone": "(773) 475-6783", "website": null, "safety_record": null, "menu_spending": {"available": false}, "detail_url": "https://jartinator.github.io/chicago-safe-streets-data/api/v1/wards/ward-12.json"}, {"ward": "13", "alderman": "Quinn, Marty", "email": "Ward13@cityofchicago.org", "phone": "(773) 581-8000", "website": null, "safety_record": {"safety_sponsorships": 2, "total_matched_sponsorships": 2, "recorded_no_votes": 0}, "menu_spending": {"available": false}, "detail_url": "https://jartinator.github.io/chicago-safe-streets-data/api/v1/wards/ward-13.json"}, {"ward": "14", "alderman": "Gutierrez, Jeylu B.", "email": "Ward14@cityofchicago.org", "phone": "773-236-0117", "website": null, "safety_record": null, "menu_spending": {"available": false}, "detail_url": "https://jartinator.github.io/chicago-safe-streets-data/api/v1/wards/ward-14.json"}, {"ward": "15", "alderman": "Lopez, Raymond A.", "email": "Ward15@cityofchicago.org", "phone": "(773) 823-1539", "website": "http://www.the15thward.org", "safety_record": {"safety_sponsorships": 1, "total_matched_sponsorships": 1, "recorded_no_votes": 0}, "menu_spending": {"available": false}, "detail_url": "https://jartinator.github.io/chicago-safe-streets-data/api/v1/wards/ward-15.json"}, {"ward": "16", "alderman": "Coleman, Stephanie D.", "email": "Ward16@cityofchicago.org", "phone": "(773) 306-1981", "website": "https://www.16thward.org", "safety_record": null, "menu_spending": {"available": false}, "detail_url": "https://jartinator.github.io/chicago-safe-streets-data/api/v1/wards/ward-16.json"}, {"ward": "17", "alderman": "Moore, David H.", "email": "Ward17@cityofchicago.org", "phone": "(773) 783-3672", "website": "http://www.David.Moore@cityofchicago.org", "safety_record": null, "menu_spending": {"available": false}, "detail_url": "https://jartinator.github.io/chicago-safe-streets-data/api/v1/wards/ward-17.json"}, {"ward": "18", "alderman": "Curtis, Derrick G.", "email": "Ward18@cityofchicago.org", "phone": "(773) 284-5057", "website": null, "safety_record": {"safety_sponsorships": 1, "total_matched_sponsorships": 1, "recorded_no_votes": 0}, "menu_spending": {"available": false}, "detail_url": "https://jartinator.github.io/chicago-safe-streets-data/api/v1/wards/ward-18.json"}, {"ward": "19", "alderman": "O'Shea, Matthew J.", "email": "Ward19@cityofchicago.org", "phone": "(773) 238-8766", "website": "http://the19thward.com/", "safety_record": {"safety_sponsorships": 5, "total_matched_sponsorships": 5, "recorded_no_votes": 0}, "menu_spending": {"available": false}, "detail_url": "https://jartinator.github.io/chicago-safe-streets-data/api/v1/wards/ward-19.json"}, {"ward": "20", "alderman": "Taylor, Jeanette B.", "email": "Ward20@cityofchicago.org", "phone": "(773) 966-5336", "website": null, "safety_record": null, "menu_spending": {"available": false}, "detail_url": "https://jartinator.github.io/chicago-safe-streets-data/api/v1/wards/ward-20.json"}, {"ward": "21", "alderman": "Mosley, Ronnie L.", "email": "Ward21@cityofchicago.org", "phone": "(773) 881-9300", "website": null, "safety_record": null, "menu_spending": {"available": false}, "detail_url": "https://jartinator.github.io/chicago-safe-streets-data/api/v1/wards/ward-21.json"}, {"ward": "22", "alderman": "Rodriguez, Michael D.", "email": "Ward22@cityofchicago.org", "phone": "(773) 762-1771", "website": null, "safety_record": {"safety_sponsorships": 2, "total_matched_sponsorships": 2, "recorded_no_votes": 0}, "menu_spending": {"available": false}, "detail_url": "https://jartinator.github.io/chicago-safe-streets-data/api/v1/wards/ward-22.json"}, {"ward": "23", "alderman": "Tabares, Silvana", "email": "Ward23@cityofchicago.org", "phone": "(773) 582-4444", "website": null, "safety_record": {"safety_sponsorships": 1, "total_matched_sponsorships": 1, "recorded_no_votes": 0}, "menu_spending": {"available": false}, "detail_url": "https://jartinator.github.io/chicago-safe-streets-data/api/v1/wards/ward-23.json"}, {"ward": "24", "alderman": "Scott, Monique L.", "email": "ward24@cityofchicago.org", "phone": "(773) 533-2400", "website": null, "safety_record": null, "menu_spending": {"available": false}, "detail_url": "https://jartinator.github.io/chicago-safe-streets-data/api/v1/wards/ward-24.json"}, {"ward": "25", "alderman": "Sigcho-Lopez, Byron", "email": "Ward25@cityofchicago.o